{
    "chapter_title": "Stack Financeira Enxuta para Startups SaaS B2B",
    "chapter_content": "Stack Financeira Enxuta para Startups SaaS B2B\nPara uma startup B2B SaaS recém-criada (sem faturamento, equipe de até 3 pessoas, foco em baixo\ncusto),  a  stack  financeira  essencial  deve  incluir:  conta  PJ  digital/cooperativa,  gestão  de  cobranças\n(boletos/Pix/cartão), emissão de NFS-e, ERP financeiro básico, e automação de rotinas. Ferramentas\ngratuitas ou baratas e integrações nativas são prioritárias. Abaixo detalhamos cada componente:\n1. Componentes Essenciais\nConta PJ digital/cooperativa: Abrir uma conta jurídica em banco digital (Inter , Cora, Banco do\nBrasil no Open Finance etc.) ou cooperativa (Sicredi, Sicoob). Ex.: Sicredi oferece “Cobrança” com\nboletos e Pix e integração via API para emissão automática, facilitando o fluxo de receitas. O\nBanco  Inter  permite  acesso  via  API  de  extratos para  contas  PJ.  Bancos  digitais  (Inter ,\nNubank,  Cora)  já  integram  com  Open  Finance  para  conciliação  automática  (vários  ERPs\npermitem importar extratos destes bancos).\nEmissão de boletos/Pix: Plataformas como Asaas, Juno, Gerencianet ou gateways (PagSeguro,\nMercado Pago, Pagar .me) permitem emissão de cobranças sem mensalidade (cobram taxas por\ntransação). Ex.: Asaas não cobra mensalidade e oferece API para criar cobranças e até emitir\nnotas fiscais via integração. PagSeguro e Pagar .me suportam vários meios (cartão, boleto,\nPix) com taxas em torno de 3–4%+fixo. Uma opção low-cost é Banco do Brasil/CNPJ via\nCNAB, mas requer relacionamento bancário.\nGateway  de  pagamento: Para  aceitação  de  cartão,  além  de  boleto.  Opções  populares:\nPagSeguro, Mercado Pago (sem mensalidade, mas taxas ~4–5%), Pagar .me (API rica, suporte a\nPix/boletos) e até PayPal/PicPay. Em geral, esses gateways cobram ~R$0,40 + 3,5–4,5% por\nvenda  no  crédito .  Escolha  baseado  no  perfil:  Mercado  Pago  bom  para  internet\n(integrações simples), Pagar .me/Asaas para APIs.\nERP  /  Gestão  Financeira: Sistemas  básicos  de  gestão  financeira  permitem  emitir  NFS-e,\ncontrolar contas a pagar/receber , fluxo de caixa e geração de relatórios. Exemplos:\nOmie Fit (gratuito): ERP 100% online gratuito para MEI ou faturamento anual até R$81 mil.\nInclui emissão de NFS-e de serviços, boletos de cobrança e integração contábil. Ideal para quem\nse qualifica como MEI.\nConta Azul Essencial: Plano para MEI a partir de R$159,90/mês (anual). Suporta emissão de\nNFS-e de serviços e integração com o app Conta Azul, incluindo cobrança via boleto/Pix\nvinculada ao PagBank . Vantagem: integração contábil forte (acesso remoto do contador).\nNibo Light: A partir de ~R$189/mês (quando anual). Inclui emissão automática de NFS-e,\nboletos e conciliação bancária inteligente. Tem importação de extratos via Open Finance\n(integra com bancos como Sicredi, Sicoob, Itaú, Inter , Nubank). Nibo Premium (mais caro)\nadiciona CNAB de pagamento Itaú/Inter e plano de contas avançado.\nGranatum: Plano único ~R$396/mês. Completo, com NFS-e e boletos ilimitados, fluxos de\ncaixa e DRE, mas é caro para startup sem receita.\nQuickBooks Online: Global (não brasileiro). Possui excelente controle de caixa e NFS-e no\nmodelo US, mas na prática não há integração fiscal brasileira nativa e requerie custo elevado\n• \n1\n2\n3 4\n• \n5\n6 7\n• \n7\n6 7\n• \n• 8\n• 9\n9 10\n• 4\n4\n3 11\n• 12\n• \n1\n(sem plano gratuito). Em geral, não recomendado para micro-startup no Brasil sem\ncontabilidade local.\nOutros grátis:MarketUP – ERP brasileiro gratuito (PDV/estoque/finanças) com emissão fiscal,\nbom para ecommerce/loja física; Wave Accounting – internacional, mas sem NFS-e local; etc.\nTabela comparativa de ERPs:\nFerramenta Plano Inicial / CustoEmissão NFS-e\nde serviço\nIntegração\nBancária\nBoleto/Pix\nintegrado\nOmie Fit Gratuito (até R$81k\nano) Sim Sim (conta digital)Sim\nConta Azul R$159,90/mês (MEI\nanual) Sim Limitada\n(PagBank)\nSim (via\nPagseguro)\nNibo (Light)R$189/mês (anual)Sim Sim (via Open\nFinance) Sim\nGranatum R$396/mês Sim Parcial (import) Sim\nQuickBooks~$100/mês (sem\ngrátis) Não nativo (EUA)Não (mesmo país)Sim (básico)\n(Fonte: sites oficiais e comparativos)\n2. Ferramentas de Gestão (ERP)\nPlanos Gratuitos/Freemium: O Omie Fit é 100% gratuito para até R$81 mil/ano. Existem\nalternativas gratuitas ou freemium focadas em PMEs (MarketUP , Cobli, etc.), mas com escopo\nlimitado. Para faturamento maior ou mais recursos, Conta Azul (MEI ~R$159/mês) e Nibo (R$189/\nmês) são de baixo custo. Granatum e Omie Pro são mais completos porém caros. \nIntegração  com  contabilidade: Todas  essas  ferramentas  permitem  conexão  com  escritório\ncontábil (eSocial, NFe, etc.). Omie e Conta Azul têm forte integração contábil (o contador acessa\ndiretamente); Nibo também exporta relatórios contábeis. Isso reduz erros de lançamentos.\nEmissão  de  NFS-e  e  Boletos: Omie  e  Nibo  possuem  módulo  interno  de  NFS-e  e  boletos\nintegrados . Conta Azul usa sua plataforma de cobranças (PagBank) para boletos/Pix.\nSe  o  ERP  não  suportar  boletos,  pode-se  usar  ferramentas  dedicadas  (Asaas,  Gerencianet)  e\nimportar no ERP .\nAvaliações de usuários: Conta Azul tem selo RA1000 no ReclameAqui (indicando suporte de\nqualidade) . Nibo e Omie também possuem boa reputação geral (embora seja importante\nvalidar recursos disponíveis na versão free ou básica). \nDRE e Relatórios: Os ERPs listados oferecem relatórios gerenciais básicos (fluxo de caixa, DRE e\nbalanço). Para startups, pode-se complementar com planilhas ou visualizações (ver item 5).\n• \n8\n9\n4 3\n12\n• 8\n• \n• \n4 8 9\n• \n13\n• \n2\n3. Automação de Processos Financeiros\nFerramentas low-code: Use plataformas como n8n (open-source), Zapier, Make (Integromat)\nou Airtable para automatizar rotinas. Ex.: criar um fluxo no Zapier que, ao gerar uma NFS-e no\nERP ,  registre  o  dado  em  uma  planilha  Google  Sheets  ou  envie  notificação  no  Slack.  N8N  é\ngratuito se auto-hospedado, permitindo chamadas a APIs bancárias ou de ERP sem custo. \nExemplos de automações: enviar e-mail automático de cobrança após gerar boleto; lançar\npagamento  de  clientes  no  ERP  ao  receber  confirmação  de  Pix  (via  webhook  ou  consulta\nperiódica  de  transações);  agrupar  lançamentos  em  relatórios  semanais  no  Google  Drive;\nsincronizar  despesas  lançadas  em  Gmail  (como  faturas  pagas)  para  o  ERP .  Plataformas  de\nautomação suportam integração com Gmail, Slack, Google Sheets, Twilio, etc.\nBancos  e  APIs: Algumas  fintechs  permitem  Webhooks/API  que  podem  ser  usados  por\nautomação (ex.: webhook de evento de Pix no seu sistema de pagamentos). Se o banco não\noferece webhooks, scripts periódicos (via n8n ou Python no servidor) podem consultar extratos\n(via open banking ou CNAB) e alimentar planilhas/ERP . Airtable pode servir como banco de\ndados leve para consolidar informações de diferentes fontes.\n4. Integrações Bancárias\nAPIs bancárias: Cooperativas e bancos digitais estão aderindo ao Open Finance. Por exemplo,\nSicredi fornece API para emissões de cobranças (boletos/Pix) e já permite o Pix Instantâneo PJ\n. O próprio Sicredi possui portal de desenvolvedor (developer .sicredi.com.br) e integra com\nfluxos  automatizados.  Banco  Inter tem  portal  dev  (developers.inter .co)  e  permite  criar\n“aplicação” para pegar extratos via API.  Caixa, Itaú, Sicoob também dispõem de APIs e\nCNAB. \nConexão  com  ERPs: Muitas  ERPs  oferecem  integração  nativa  com  bancos  brasileiros.  Por\nexemplo, o Nibo “integra aos principais bancos” (logos de Sicredi, Sicoob, Itaú, Inter , Nubank são\nexibidos) .  Omie  permite  configurar  integração  com  Inter  (importação  automática  de\nextratos)  e também com outros bancos via Open Finance. Em casos sem integração nativa,\nextratos podem ser baixados manualmente ou via CNAB (o Nibo Premium, por ex., aceita CNAB\nItaú/Inter ).\nContas  Cooperativas: No  Brasil,  cooperativas  de  crédito  (Sicredi,  Sicoob)  funcionam\nsimilarmente a bancos e já trabalham com APIs e Pix PJ. Certifique-se de que o ERP escolhido ou\nplataforma de automação consegue conectar-se ou importar arquivos dessas contas. Caso não\nexista integração, considere usar o Pix Cobrança do banco (GEMD) para automatizar recebíveis,\nconectado ao seu software financeiro via API ou webhook.\n5. Dashboards e Relatórios\nFerramentas de visualização: Para monitorar finanças use ferramentas de BI gratuitas. Ex.:\nGoogle  Data  Studio  (Looker  Studio) é  grátis  e  conecta-se  a  Google  Sheets,  BigQuery  ou\nconnectors diversos. Permite criar dashboards de DRE, fluxo de caixa e indicadores-chave.\nNotion pode armazenar textos e gráficos incorporados (há hacks para embutir relatórios do\nData  Studio  no  Notion).  Excel  365  ou  Power  BI  gratuitos  (versão  Desktop)  também  podem\nconectar-se a bases de dados ou APIs, mas exigem licença paga para compartilhamento.\n• \n• \n• \n• \n1\n2\n• \n3\n2\n11\n• \n• \n14\n3\nTemplates prontos: Use planilhas modelos para DRE, fluxo de caixa e projeções. Exemplos\ngratuitos: a Coalize oferece planilha DRE básica para download; Sebrae, Distrito e Endeavor\nfornecem modelos de projeções (procure em sites como Sebrae ou Exame PME “planilha DRE\nstartup”).  Integre  esses  templates  com  dados  reais  via  importação  CSV  ou  Google  Sheets\nconectado ao ERP . \nFluxo de caixa e projeções: Utilize o ERP (a maioria já tem relatório de caixa projetado) ou\nmonte no Google Sheets. Ferramentas como  Airtable permitem criar tabelas interativas de\nreceitas/despesas e gráficos simples. Notion, apesar de não ser ferramenta de BI, pode agregar\nrelatórios estáticos ou incorporados para centralizar informação.\n6. Roadmap de Implementação (Fases)\nPara equipe enxuta, implemente gradualmente, priorizando o essencial: \nSemana 1 (Setup inicial):\nAbrir conta PJ digital: Escolha banco/cooperativa (ex.: Inter ou Sicredi) que ofereça c